Município,Sugestões e Recomendações para Melhorias
Alambari,"Lorem ipsum dolor sit amet, consectetur adipiscing elit."
Alumínio,Cras euismod massa ut augue rutrum blandit.
Americana,Sed vel ligula fermentum orci hendrerit interdum ullamcorper at massa.
Araçariguama,Fusce sodales urna eget consequat pellentesque.
Araçoiaba da Serra,Suspendisse eget lectus a ligula tristique bibendum.
Artur Nogueira,Nullam placerat dolor a risus egestas congue.
Boituva,"Quisque faucibus purus at quam condimentum, ac malesuada tellus congue."
Campinas,Donec at dui nec orci pulvinar rutrum.
Capela do Alto,Pellentesque eget justo non lorem commodo euismod.
Cerquilho,Quisque tempus justo nec dapibus pharetra.
Cesário Lange,Pellentesque ut ipsum suscipit augue mollis pellentesque eget non erat.
Cosmópolis,Donec in massa non nulla consectetur eleifend.
Diadema,"Morbi id est bibendum, pellentesque elit non, consequat velit."
Engenheiro Coelho,"Pellentesque at elit sodales, rutrum tortor sit amet, molestie justo."
Holambra,"Curabitur aliquam lorem nec ligula feugiat, auctor cursus est mattis."
Hortolândia,Integer euismod enim non mollis faucibus.
Ibiúna,Suspendisse imperdiet justo ut nisl volutpat pretium.
Indaiatuba,Duis in sem non quam dignissim aliquam et non nulla.
Iperó,Fusce eget magna imperdiet ipsum scelerisque pellentesque.
Itapetininga,Integer eleifend ligula id fermentum auctor.
Itatiba,Maecenas feugiat urna sit amet placerat tempor.
Itu,"Mauris eu odio blandit, vestibulum odio non, scelerisque mauris."
Jaguariúna,"Fusce vitae justo vulputate, interdum est ut, tempus urna."
Jumirim,"Nam porttitor elit non quam rhoncus, in pellentesque tortor condimentum."
Mairinque,"Morbi in mauris tristique, finibus nisl at, dapibus dolor."
Mauá,Donec sit amet nunc sit amet felis cursus vulputate vitae et ipsum.
Monte Mor,Morbi sodales quam sit amet dui efficitur lacinia.
Morungaba,Praesent non mi at augue elementum scelerisque.
Nova Odessa,"Sed sed mi tempus, interdum lorem in, elementum metus."
Paulínia,Nam semper quam id arcu auctor rhoncus.
Pedreira,Pellentesque dignissim ex quis semper efficitur.
Piedade,Suspendisse eget nulla sed tortor fringilla dictum id sed ligula.
Pilar do Sul,Curabitur ultrices velit sed mollis lobortis.
Porto Feliz,"Fusce placerat arcu ac dolor tincidunt, ut commodo ex faucibus."
Ribeirão Pires,Cras sed dui non urna dictum consectetur.
Rio Grande da Serra,"Aenean eu urna volutpat, tempor enim tristique, vehicula nisi."
Salto,"Nulla a sapien hendrerit, efficitur nibh vitae, accumsan velit."
Salto de Pirapora,Ut dictum massa nec dignissim cursus.
Santa Bárbara D'Oeste,Morbi viverra turpis tincidunt dui tempus viverra.
Santo André,"Duis nec ante elementum, blandit orci sed, efficitur eros."
Santo Antônio de Posse,Nunc eu sapien ac lectus tincidunt posuere quis eu mauris.
São Bernardo do Campo,Proin tempus enim id ornare fringilla.
São Caetano do Sul,Morbi a mauris ut turpis suscipit lobortis.
São Miguel Arcanjo,Proin molestie nisi in nisi tincidunt dignissim.
São Roque,Praesent euismod tortor nec ligula hendrerit rutrum.
Sarapuí,Mauris commodo libero dictum tellus accumsan consectetur.
Sorocaba,"Aliquam id dolor suscipit, accumsan nulla ac, pellentesque ipsum."
Sumaré,Donec nec lacus ut sapien congue semper ut vel turpis.
Tapiraí,Nunc bibendum odio vitae convallis pellentesque.
Tatuí,Duis blandit dui in orci fermentum efficitur.
Tietê,"Nam pulvinar libero vel dui dapibus, sit amet lacinia ipsum elementum."
Valinhos,Morbi aliquam nunc eu sagittis interdum.
Vinhedo,Integer at lorem vel nisl maximus fringilla in ut nunc.
Votorantim,"Donec ullamcorper nisl ut lacus lacinia, ut tempus sem convallis."
Alambari,Nam mattis mauris ac enim tincidunt semper.
Alumínio,Nam malesuada nulla id elit rhoncus varius.
Americana,Sed a orci ac eros dictum laoreet.
Araçariguama,Donec vitae mi eget leo blandit suscipit.
Araçoiaba da Serra,"Ut vel elit sollicitudin, condimentum purus viverra, consequat eros."
Artur Nogueira,"Curabitur sed lectus luctus, mattis magna vel, mattis lorem."
Boituva,Vestibulum porttitor nisl nec tempor rhoncus.
Campinas,"Sed interdum enim ac massa gravida, volutpat maximus felis tempus."
Capela do Alto,Ut auctor urna nec lectus euismod facilisis.
Cerquilho,Fusce in libero eu elit interdum consectetur sit amet nec est.
Cesário Lange,Pellentesque quis justo in nisl convallis feugiat ut id mauris.
Cosmópolis,"Maecenas nec eros finibus, aliquam arcu vehicula, pellentesque sem."
Diadema,Cras faucibus elit nec aliquam hendrerit.
Engenheiro Coelho,Integer volutpat elit eget nisl dignissim viverra.
Holambra,Ut id tortor at ex iaculis rutrum.
Hortolândia,Nullam vitae risus quis ipsum mattis rutrum.
Ibiúna,Quisque accumsan est sit amet ante viverra commodo.
Indaiatuba,"Sed porttitor ante eu tortor interdum, commodo lacinia leo dictum."
Iperó,"Phasellus cursus mi vel ipsum consequat, vel maximus nibh fermentum."
Itapetininga,Etiam egestas ipsum a semper pharetra.
Itatiba,"Mauris efficitur odio in mauris tincidunt, sit amet fermentum mi ullamcorper."
Itu,Cras pellentesque nisl ut sollicitudin rhoncus.
Jaguariúna,Cras ullamcorper velit eu elit laoreet fringilla.
Jumirim,"Sed at nisi lobortis, vehicula sem dignissim, fringilla velit."
Mairinque,Ut dictum lectus eget tincidunt vulputate.
Mauá,Vestibulum non ex vitae quam egestas egestas.
Monte Mor,"Donec mollis risus ac velit blandit, ac aliquet magna varius."
Morungaba,Integer convallis odio sit amet auctor tincidunt.
Nova Odessa,Phasellus non dolor sit amet diam molestie tempor.
Paulínia,"Vestibulum tempor metus ac nisl blandit, a porta tortor condimentum."
Pedreira,Mauris molestie lacus a magna malesuada mollis.
Piedade,Cras ac nisi eu nisl convallis suscipit.
Pilar do Sul,"Donec quis libero faucibus, tincidunt nisl quis, fermentum risus."
Porto Feliz,Ut non metus ut magna fringilla porttitor.
Ribeirão Pires,"Maecenas commodo nisl sit amet urna varius, non pretium est bibendum."
Rio Grande da Serra,"Ut a lectus condimentum, sagittis velit nec, scelerisque sapien."
Salto,Suspendisse non nisi at arcu commodo ultricies sed quis neque.
Salto de Pirapora,Aenean commodo sem ac libero posuere lacinia.
Santa Bárbara D'Oeste,Mauris suscipit ligula venenatis sem accumsan blandit.
Santo André,"Aliquam at nibh rutrum, pretium turpis vitae, laoreet eros."
Santo Antônio de Posse,Sed molestie risus ut ipsum lacinia accumsan.
São Bernardo do Campo,"Proin non lectus pharetra, accumsan dui vel, tristique est."
São Caetano do Sul,Mauris consectetur lorem a turpis viverra consequat.
São Miguel Arcanjo,"Proin id ligula vestibulum, lacinia est at, blandit ipsum."
São Roque,Donec molestie metus at eleifend cursus.
Sarapuí,"Aenean quis tellus iaculis, fermentum nulla in, volutpat quam."
Sorocaba,Duis suscipit tortor ac ultricies tristique.
Sumaré,Mauris volutpat tortor sit amet accumsan venenatis.
Tapiraí,Phasellus nec sem non augue vestibulum convallis sit amet eu leo.
Tatuí,Suspendisse vitae ipsum fermentum libero pellentesque sagittis at eget lectus.
Tietê,"Aliquam aliquet turpis ut ligula cursus, id faucibus est porttitor."
Valinhos,"Ut sollicitudin arcu et mi elementum, vel rutrum ligula fringilla."
Vinhedo,"Nunc pretium ligula sit amet massa laoreet, eu bibendum nunc pulvinar."
Votorantim,Vestibulum fringilla nisl id rhoncus finibus.
Alambari,Mauris aliquet orci eget dui porta dapibus.
Alumínio,Mauris tempor ante non libero rutrum placerat.
Americana,Proin non augue nec nunc viverra euismod.
Araçariguama,"Praesent quis nunc dictum, convallis nulla eu, rhoncus ante."
Araçoiaba da Serra,"Nunc sed sapien maximus, imperdiet ligula eu, consequat nunc."
Artur Nogueira,Curabitur imperdiet ante vel tempor condimentum.
Boituva,Fusce interdum nibh in facilisis dignissim.
Campinas,"Nunc congue ante nec tortor molestie, sit amet venenatis risus imperdiet."
Capela do Alto,"Duis accumsan mauris consectetur purus tincidunt, non tempus dolor dapibus."
Cerquilho,"Phasellus molestie nunc vel orci rutrum, eu dignissim leo congue."
Cesário Lange,Maecenas porta quam quis feugiat auctor.
Cosmópolis,"Pellentesque at urna malesuada, congue odio non, iaculis dolor."
Diadema,Proin ac quam nec mi ornare mattis.
Engenheiro Coelho,"Duis euismod sem eget ante finibus, venenatis feugiat ipsum cursus."
Holambra,Duis vitae dui vel nibh commodo bibendum.
Hortolândia,Pellentesque gravida mauris non nunc auctor interdum.
Ibiúna,"Praesent aliquet nibh sit amet elit commodo, in tristique erat gravida."
Indaiatuba,"Sed nec est lobortis, ultrices neque venenatis, bibendum urna."
Iperó,"Nunc vitae nisl gravida, dapibus erat consectetur, sollicitudin libero."
Itapetininga,"Aenean tristique libero nec justo volutpat, vitae mollis justo fringilla."
Itatiba,Nulla dictum risus a sapien vulputate semper.
Itu,"Fusce auctor nibh facilisis, aliquam lacus non, pulvinar nisl."
Jaguariúna,"Vivamus imperdiet dolor quis nibh pulvinar, eget efficitur justo molestie."
Jumirim,Vestibulum lobortis augue id ultrices fermentum.
Mairinque,Fusce eget felis semper arcu malesuada feugiat dignissim et libero.
Mauá,Aenean imperdiet erat ut sodales ultrices.
Monte Mor,"Vestibulum ac purus congue, ultrices arcu ac, blandit mi."
Morungaba,Pellentesque sed ex a eros sagittis bibendum.
Nova Odessa,Sed blandit elit sed suscipit tempus.
Paulínia,"Aliquam tincidunt tortor a lacus faucibus, id commodo ligula malesuada."
Pedreira,Duis quis enim vel orci suscipit finibus vitae vel est.
Piedade,"Morbi et quam vulputate, pellentesque felis et, aliquam dolor."
Pilar do Sul,Aliquam sollicitudin mi at tortor laoreet molestie.
Porto Feliz,"Pellentesque vel mi sagittis, consequat nibh in, consectetur arcu."
Ribeirão Pires,Maecenas vehicula ligula eu velit rutrum lobortis eu sit amet justo.
Rio Grande da Serra,Aliquam mollis tortor vel magna finibus sollicitudin.
Salto,Donec commodo risus vel consectetur condimentum.
Salto de Pirapora,"Nulla vitae diam luctus, faucibus justo sit amet, pretium lorem."
Santa Bárbara D'Oeste,Donec varius velit sit amet odio blandit maximus.
Santo André,Sed condimentum erat non dignissim condimentum.
Santo Antônio de Posse,Maecenas maximus quam in blandit cursus.
São Bernardo do Campo,Nullam at elit nec purus tincidunt feugiat auctor et lorem.
São Caetano do Sul,"Integer finibus lorem ut eros commodo, a auctor est euismod."
São Miguel Arcanjo,Aenean semper nisi vel magna porttitor laoreet.
São Roque,Suspendisse vehicula quam nec porttitor commodo.
Sarapuí,Cras quis magna sit amet orci elementum vestibulum.
Sorocaba,Vestibulum sed sapien eu arcu rutrum faucibus.
Sumaré,Mauris placerat felis et magna placerat ornare.
Tapiraí,Nullam malesuada ligula id euismod sagittis.
Tatuí,Donec pulvinar augue sed interdum rhoncus.
Tietê,Donec efficitur justo vitae dui vulputate interdum.
Valinhos,Vivamus mattis augue id turpis convallis iaculis.
Vinhedo,Duis malesuada turpis sed dui imperdiet egestas.
Votorantim,Ut tristique erat in tristique blandit.
Alambari,Phasellus vel purus non dui tempor commodo ut vitae nunc.
Alumínio,Vivamus consequat dui vel elit dapibus consectetur.
Americana,"Suspendisse dignissim felis blandit, pulvinar dolor vitae, varius velit."
Araçariguama,Maecenas dignissim enim ut arcu bibendum finibus.
Araçoiaba da Serra,Mauris placerat quam ut dictum auctor.
Artur Nogueira,Praesent aliquam enim vitae ipsum vulputate dictum.
Boituva,Nullam iaculis purus ut eleifend dapibus.
Campinas,Donec fringilla ligula in eros hendrerit maximus.
Capela do Alto,Maecenas sagittis quam et imperdiet vulputate.
Cerquilho,Praesent mattis ipsum nec commodo imperdiet.
Cesário Lange,"Duis in lorem volutpat, pretium ex ut, scelerisque lectus."
Cosmópolis,Phasellus quis mauris ac felis semper commodo.
Diadema,Vivamus dapibus dolor eget varius faucibus.
Engenheiro Coelho,In ultrices nunc in velit luctus ultrices.
Holambra,Etiam vulputate nisi eget metus sagittis pretium.
Hortolândia,Nulla sed dui nec massa tempor eleifend.
Ibiúna,Phasellus ac diam eu nisi sagittis aliquet porta nec risus.
Indaiatuba,Suspendisse viverra quam sit amet tellus maximus ultricies.
Iperó,Sed mollis magna sit amet tellus gravida aliquam.
Itapetininga,Phasellus at sem id magna ullamcorper posuere a eu est.
Itatiba,Nullam semper enim lobortis efficitur imperdiet.
Itu,"Sed quis metus tempor, gravida turpis ut, ultrices ex."
Jaguariúna,Fusce ornare enim id velit iaculis dignissim.
Jumirim,"Quisque et nibh efficitur, convallis justo vitae, porta sem."
Mairinque,"Aenean tristique lectus in tortor posuere, quis bibendum sapien dapibus."
Mauá,"Duis ut erat mattis, vestibulum enim mattis, ultricies ligula."
Monte Mor,Vestibulum nec leo sed purus egestas malesuada fringilla venenatis odio.
Morungaba,Nulla venenatis ante at mauris consectetur tempor.
Nova Odessa,Ut sodales urna in tortor mattis euismod.
Paulínia,"Duis feugiat libero a nunc maximus, porttitor molestie elit sodales."
Pedreira,Donec sit amet turpis ac libero feugiat pellentesque.
Piedade,"Suspendisse scelerisque erat a odio ultricies, at eleifend nisi imperdiet."
Pilar do Sul,Duis fermentum sem non sodales dignissim.
Porto Feliz,Pellentesque vitae purus bibendum erat ultricies aliquet.
Ribeirão Pires,Maecenas hendrerit leo ornare consectetur scelerisque.
Rio Grande da Serra,Sed eget ante vitae libero tempus malesuada.
Salto,Integer condimentum enim eu felis ultricies finibus.
Salto de Pirapora,Cras condimentum enim nec dictum malesuada.
Santa Bárbara D'Oeste,Vestibulum aliquam nibh eget dolor cursus elementum.
Santo André,Nam eu libero eget diam convallis fermentum ut sit amet sem.
Santo Antônio de Posse,In suscipit lacus sit amet metus euismod ornare.
São Bernardo do Campo,Ut quis mi id velit maximus imperdiet.
São Caetano do Sul,"Etiam fermentum lacus non nisi molestie, vel consequat augue mollis."
São Miguel Arcanjo,Praesent condimentum metus id mauris commodo blandit.
São Roque,Vestibulum quis justo nec ante pretium tempus.
Sarapuí,Morbi quis neque at arcu pretium convallis vitae dictum arcu.
Sorocaba,"Proin malesuada diam sit amet arcu mattis, sed lobortis dolor consequat."
Sumaré,Morbi vulputate quam non mollis sollicitudin.
Tapiraí,Duis at sapien ut sapien vehicula tristique.
Tatuí,Donec in ligula sed sapien dignissim vestibulum.
Tietê,"Vestibulum ac sem tristique, sodales arcu vitae, volutpat dui."
Valinhos,Nam in libero sit amet quam placerat consectetur.
Vinhedo,Fusce sed nibh ut quam imperdiet feugiat.
Votorantim,Cras vel elit ac erat vestibulum tincidunt in sit amet ex.